<?xml version="1.0" encoding="UTF-8"?>

<Pedidos xmlns:xsi="http://www.w3.org/2001/XMLSchema-instance" xsi:noNamespaceSchemaLocation="pedidos2.xsd">
 
    <Pedido CodigoPedido="ABC123fc">
        <Sucursal>
            <DirEntrega>Direccion1</DirEntrega>
            <SedeCentral/>
        </Sucursal>  
        <NombreTrabajador>Juan Perez</NombreTrabajador>
        <FechaPedido>2024-03-05</FechaPedido>
        <ObservacionesPedido>Urgente</ObservacionesPedido>
        <PlazoRevision>7 días</PlazoRevision>
        <Articulos>
            <Articulo CodigoArt="ABD-123">
                <UnidadesPedidas>10</UnidadesPedidas>
                <PrecioUnidad>20.00</PrecioUnidad>
                <ObservacionesArt>Artículo de alta demanda</ObservacionesArt>
            </Articulo>
        </Articulos>
    </Pedido>
</Pedidos>
